id,url,title,company_name,company_url
1,https://detail.1688.com/offer/914485682936.html,新款沃凯wokai商务腕表休闲皮带石英运动表男士手表男表工厂批发,广州市斯达钟表商行,https://shop903o781379i22.1688.com/page/creditdetail.htm
2,https://detail.1688.com/offer/701707160535.html,2023钢带led电子手表超薄金银冷光表 F91W钢带原宿风时尚多功能表,广州市斯达钟表商行,https://shop903o781379i22.1688.com/page/creditdetail.htm
3,https://detail.1688.com/offer/690531443069.html,外贸新款热卖时尚三眼月亮地球日历男士手表男表皮带款石英表批发,义乌万悦表业有限公司,https://monyorn.1688.com/page/creditdetail.htm
4,https://detail.1688.com/offer/643376198655.html,方块经典复古防水多功能运动电子表方形时尚电子表同款夜光合金表,SYNOKE/时诺刻品牌旗舰店,https://synoke.1688.com/page/creditdetail.htm
5,https://detail.1688.com/offer/789631898234.html,手表SYNOKE夜光防水运动男士轻薄方形经典学生手表东南亚市场,SYNOKE/时诺刻品牌旗舰店,https://synoke.1688.com/page/creditdetail.htm
6,https://detail.1688.com/offer/776275839790.html,SYNOKE时诺刻潮流新颜色方形合金运动电子表男士时尚大屏防水腕表,SYNOKE/时诺刻品牌旗舰店,https://synoke.1688.com/page/creditdetail.htm
7,https://detail.1688.com/offer/716780052860.html,男士运动电子表亚克力镜面户外登山多功能夜光大屏防水潮流时尚学,SYNOKE/时诺刻品牌旗舰店,https://synoke.1688.com/page/creditdetail.htm
8,https://detail.1688.com/offer/844656052393.html,外贸爆款时尚酒桶硅胶带三眼蓝针男士手表男表石英表厂家现货批发,义乌万悦表业有限公司,https://monyorn.1688.com/page/creditdetail.htm
9,https://detail.1688.com/offer/673384790489.html,直播爆款镶钻满钻罗马纹女士手表女表手链聚宝盆女款一件代发货源,义乌万悦表业有限公司,https://monyorn.1688.com/page/creditdetail.htm
10,https://detail.1688.com/offer/719462395105.html,直播热卖爆款时尚四叶草手链石英手表绿宝石女士手表女表厂家批发,义乌万悦表业有限公司,https://monyorn.1688.com/page/creditdetail.htm
11,https://detail.1688.com/offer/815604447282.html?spm=a26352.13672862.offerlist.92.1cca1e62oYQ7S8&cosite=-&tracelog=p4p&_p_isad=1&clickid=f687ead9e2a1435fb0c9647a5c44ab09&sessionid=97297506cf4c4dc481b3d102ef6ecdca,小众时尚独特个性潮流锆石手链女轻奢百搭设计简约高级感手饰批发,东阳市巧欢饰品有限公司,https://shop1442508391642.1688.com/page/creditdetail.htm
